<?xml version="1.0" ?>
<repository xmlns="https://phar.io/repository"
            xmlns:xsi="http://www.w3.org/2001/XMLSchema-instance"
            xsi:schemaLocation="https://phar.io/repository https://phar.io/data/repository.xsd">

    <phar name="phpdox">
        <release version="0.8.1.1" url="https://github.com/theseer/phpdox/releases/download/0.8.1.1/phpdox-0.8.1.1.phar">
            <signature type="gpg"/>
            <hash type="sha-1" value="0bc45b960028cd1517f3969a61e4a8e5e30c79f0"/>
        </release>
        <release version="0.8.1" url="https://github.com/theseer/phpdox/releases/download/0.8.1/phpdox-0.8.1.phar">
            <signature type="gpg"/>
            <hash type="sha-1" value="b74cbc6c1d20393b46b731efe964095f7e0d68df"/>
        </release>
        <release version="0.8.0" url="https://github.com/theseer/phpdox/releases/download/0.8.0/phpdox-0.8.0.phar">
            <signature type="gpg"/>
            <hash type="sha-1" value="5e08ad78f0f8aaa3450151e9ed6bb37c76b0c224"/>
        </release>
    </phar>

</repository>
